{"artifacts":[{"byte_size":33,"digest":"sha256:50496bf4243ed4da6ce033eadc316213a38ccde454a2bdf0fb0da86f9462202d","media_type":"application/json","path":"changeset/change-set.json"},{"byte_size":31,"digest":"sha256:961de58433fc78da286e9d1af567394ccd5ee80ee55620dca8f0771fc38b8562","media_type":"application/vnd.git.binary-patch","path":"changeset/change.patch"},{"byte_size":33,"digest":"sha256:0f62899ac1ef8e18ca75e929ea56e261c2616eaa9085738245b7d081b364791d","media_type":"application/json","path":"checkpoints/1/checkpoint.json"},{"byte_size":636,"digest":"sha256:a7669bc04f3bf6496178887ab0550ab374891f0470b9fcf460472860bc4a3e28","media_type":"application/x-ndjson","path":"events.ndjson"}],"event_stream":{"byte_size":636,"digest":"sha256:a7669bc04f3bf6496178887ab0550ab374891f0470b9fcf460472860bc4a3e28","media_type":"application/x-ndjson","path":"events.ndjson"},"protocol":"factory-runner-protocol/v1","schema":"protocol-manifest/v1","schema_version":1}