{"artifacts":[{"byte_size":0,"digest":"sha256:e3b0c44298fc1c149afbf4c8996fb92427ae41e4649b934ca495991b7852b855","media_type":"application/x-ndjson","path":"events.ndjson"}],"event_stream":{"byte_size":0,"digest":"sha256:e3b0c44298fc1c149afbf4c8996fb92427ae41e4649b934ca495991b7852b855","media_type":"application/x-ndjson","path":"events.ndjson"},"protocol":"factory-runner-protocol/v1","schema":"protocol-manifest/v1","schema_version":1}